Wish I had something better for you but best of luck to you , this situation sucks	8	desire
Ha me too . I ’ m afraid we ’ ve been called out	14	fear
Missed that part , but now I see where you are coming from .	9	disappointment
I never used an escalator until I was about 16 and I still remember moving stairs scaring the hell out of me	14	fear
Lol would share half of the sofa 10 / 10 times for either of those sweet doggos !	13	excitement
I ' m on your side with this one . At least you have some legs to stand on .	5	caring
I honestly couldn ' t care less if we lose or not . I ' m over the moon about [ NAME ] and nothing could make me unhappy	9	disappointment
One need not spend much time in the justice system to understand that this remains very much a real possibility in 2019 .	22	realization
the father sending up 4 donuts every morning via stair lift to dtr , before she even comes down to breakfast , wonders if he is enabling her .	26	surprise
Yeah I ' m actually pretty surprised that ' s not a thing yet , there ' s gotta be a lot of people working on it .	26	surprise
I wish they would put dfs in for [ NAME ] right now	8	desire
Sadly I see it being a call to party like there is no tomorrow for the vast majority .	9	disappointment
I ’ d tell her nothing , that freaking weirdo would just never see my kid . The End . Disgusting .	11	disgust
Tis nothing but a scratch	9	disappointment
Have you told him you aren ' t 100 % ok with it ? It sounds like you ' re regretting this decision .	24	remorse
mtv has agreed to take some of the load by having them on . . . i wonder if they get paid per appearance or flat season fee .	26	surprise
Happy B ' day for Thursday !	13	excitement
Are you ok ?	5	caring
Don ' t forget colors . They panic at the sight of a chess board .	14	fear
The Internet is a weird place .	11	disgust
Please come and visit again soon ! Have a safe flight !	5	caring
""" For a second there I read the subreddit as "" "" furry and sad "" "" . Pretty disappointed . """	9	disappointment
This . You need medical attention and they ' ll be able to put you in touch with resources .	5	caring
There are some amazingly cringey compilations of terrible dialogue from this show on yt	13	excitement
There is no such thing as ' incel worldview ' . Youve been indoctrinated by other subs , most likely [ NAME ] . Admit that you ' re wrong and move on .	22	realization
You have nothing to lose by going to the police now . They may help with the restraining order , shelter , etc .	5	caring
Seriously ? That ’ s so frustrating . It was [ NAME ] time to go , some of these “ fans ” are disgusting .	11	disgust
I ' m surprised [ NAM ] didn ' t bust that dress open when she bent down to high [ NAMEE ]	26	surprise
Welcome to CTH where everyone pretends that socialism will work , next time .	13	excitement
The main reason I left is a hidden mmr used to influence matchmaking in a mode that requires a paid entry . That ' s disgusting	11	disgust
I wonder what the laws are if you bartered for a gun . I wash your car , you give me a glock .	8	desire
I feel terrible but I do this too , or watch obese people doing mukbangs	14	fear
[UNK] wow . . . I read it all in a serious tone until the end ! [UNK]	13	excitement
I am scared that I would lose potential study time by seeing him . And worse if I end up liking him too much . . . : (	14	fear
How to instantly look 20 years younger !	13	excitement
I like it I just wish he ’ d drop the m and apostrophe	8	desire
Oh no , her eyebrows	11	disgust
His interviews are so awkward	12	embarrassment
I didn ' t know [ NAME ] was in a j rock band	26	surprise
you ' d have to help them get past [ NAME ] extremely tough immigration process	5	caring
Go to about the 13 minute mark . It gets better for her .	5	caring
Mate you ' re talking to a Remainer who wants to Remain . . . I just want a Labour Government that ' s all .	8	desire
. . . . That literally made my stomach clench . I can ' t believe they are charged for the samples . . . Just eww .	11	disgust
poor [ NAM ] . Someone else on here called her [ NAMEE ] from Family Ties . [UNK] I legit feel for her .	5	caring
""" 60 young men standing around . . . "" "" Look out that old native dude is coming right at us . . . DEFENSIVE POSITION SHIELDSS UP ! "" "" """	19	nervousness
This actually happened but no one clapped	9	disappointment
Fus Ro D . . omg the sun is coming up	13	excitement
I find sativa makes me paranoid / anxious as hell . Indica calms me down more . Smoking too much of any strain makes me anxious by time though	19	nervousness
Cant wait for the [ N ] [ NAMAM ] vs [ NAMEEE ]	13	excitement
Yeah Q was bad card I was just bloating the pot . I definitely feel this is one of the worst hands I ’ ve played .	9	disappointment
Avoid . Without a contract he can kick you out at short notice any time And when you pay a deposit make sure it ' s protected .	5	caring
Since it ' s a very unlucky case i would tell you to just have a really big amount of pacience and maybe have a date once a time	5	caring
I ' m too late to rub this into all the casual ' s faces . : (	9	disappointment
Surprises me how a dude that let his keyboard get to this point even cares enough to clip his nails in the first place .	26	surprise
What an unbelievable coward	26	surprise
Ohhhhh that couple !	26	surprise
I am so excited for tonight ' s episode ! It ' s barely even started * _ *	13	excitement
It ’ s still not working unfortunately : ( , you have a link to your YT ?	9	disappointment
Its almost as if everyone is too afraid to be politically incorrect to admit that height and race are a factor .	14	fear
I feel the guy did this only to correct his mistake and to pretend it never happened .	22	realization
not surprised it ’ s too challenging for you to read	5	caring
Gee I wish .	8	desire
scared for sure . . . scared of how much money we ' re gonna have to pay him it ' s gonna be all the moneys	14	fear
I wonder if we will get to actually see the demise of their relationship . I doubt they will do it on the show though .	26	surprise
Sorry that you lost that stuff . But that ' s a lot to have in your car in SF	24	remorse
yep . I feel guilty for throwing them out but they ' re basically useless .	24	remorse
Don ’ t fall for it .	5	caring
Disgusting amount of oil .	11	disgust
Today I wish I were a black bear .	8	desire
Sorry to hear that , I hope you ' re doing better now .	24	remorse
Tfw when not only is it tiny , but it ’ s damn ugly too . : (	11	disgust
me . i ’ m the problem . i don ’ t think anyone can help me anymore .	9	disappointment
Yes , yes , yes . Oh my [ NAME ] !	13	excitement
Wish a cute girl would stare at me .	8	desire
This moment ALWAYS makes me think of the “ hzuh ” Walmart rat vine	22	realization
personally ive noticed some of our sars are coming out darker than normal so idk loo extra strong i guess	22	realization
> i don ' t feel so good ( mister [ NAME ] ) . r / unexpectedspiderman	9	disappointment
I know many bf who would be excited for that	13	excitement
Oh , that ' s horrible . My condolences .	16	grief
Laziest team I ' ve ever seen .	11	disgust
Oh good grief ! Put it away , [ NAME ] .	16	grief
Seconded . 8 years and I never reached the final castle .	9	disappointment
Just try the free trial . I got bored of it in 4 hours , so no buy for me .	9	disappointment
I still wish if we get a deeper face customization like in RPGs .	8	desire
Nice I am actually going to the game ! Awesome I ' ll get to see him represent .	13	excitement
this made me stop subconsciously breathing and now I can ' t stop thinking about it	19	nervousness
happy cake day !	13	excitement
Yes , once I even deleted my account because I was so nervous about down votes . Lately , every once in a while I comment encouraging good attitude .	19	nervousness
Oops . My bad	9	disappointment
their is a differences between losing and being embarrassed	12	embarrassment
Nooo . Ireland will now lose those two rounds . The world is unfair	9	disappointment
Other than family , I neither remember the last time I got a compliment	22	realization
Wow ! If they were to follow that logic , they would have to ask why on earth we were given doctors ! Insanity .	13	excitement
It ' s the hard R that ' ll get you in trouble .	14	fear
I wish my nickname was [ NAME ]	8	desire
Sitting here , waiting for the price to drop so i can buy more . I guess it ' s not gonna happen .	9	disappointment
We don ' t know anything yet till it happens . It ' s great to see everything think they know the eliminations order . . . . . lol . you will be shooked	26	surprise
You were shot by a Vigilante !	26	surprise
Expect the unexpected [ NAME ] funding secured .	8	desire
That I was unbreakable . It took some serious injuries in “ high school ” until I realized that I wasn ’ t .	22	realization
I ’ ve started the journal part ! But I unfortunately need to wait until he gets more aggressive for them to act on it .	9	disappointment
And then we wish for winter because it ' s so damn hot , thus the cycle continues .	8	desire
I ’ m worried about [ NAME ] too	14	fear
The [ NAME ] of horror !	14	fear
i can change mood for no reason on seconds . Im happy ish . To sad or frustrated to anger and rage and not always in that order .	21	pride
Crazy how before the offseason everyone was talking 350 - 400 mill deals for [ NAM ] and [ NAMEE ] as if that was all but inevitable	26	surprise
This team needs to tighten up in the third . Absolutely brutal .	11	disgust
I remember when reddit ' s default subs suddenly turned from [ NAM ] to [ NAMEE ] in a day .	22	realization
This team is so untalented .	9	disappointment
Omg . I hope she is ok ! Poor [ NAME ] .	5	caring
I SWEA I DIDNT MEAN TO ANWER 2 HOURSS LATERR FORGIVE MEEE	24	remorse
Man you ' d be shocked to know some women still remain passive even when married .	26	surprise
It ' s like Guatemala , but instead of the US it ' s Mexico . . . disgusting	11	disgust
The foul , smelly dump I just took > fallout 76	11	disgust
hMMM [ NAME ] is actually my worst hero in the game . I ’ ll work on him , though	22	realization
Reminds me of Ross Lake WA	22	realization
And that was more or less the manager ' s position on it . He was obviously trying very hard not to call her stupid to her face .	22	realization
Alway protect yourself	5	caring
Don ' t be afraid to go through therapy .	5	caring
Need to go middle of the road no [ NAM ] is going to vote for [ NAMEE ] .	9	disappointment
Damn ! You were so close ! Scary . Damn damn !	14	fear
I wish ours was like that .	8	desire
Someone please send me the full episode I need to see the rest : (	8	desire
At least she ' s not a dirty little hamster .	23	relief
It ' s not something i ' m proud of , but I definitely fucked up that day .	11	disgust
Right on . Hi from saskatoon canada . Take care buddy	5	caring
Um Hmmmm . Too bad [ NAME ] can ' t be reached via Ouija Board . People really need his help .	9	disappointment
Yeah , I ' m like I ' ll get on and play some Magic Arena , but every time I ' m like this game is terrible AF .	22	realization
OMG THOSE TINY SHOES ! * desire to boop snoot intensifies *	8	desire
At least this makes me feel better about not being photogenic . It ’ s the cameras fault !	23	relief
i can ' t believe i havent seen this before . well i was going to watch nosferatu tonight but change of plan	26	surprise
I ' m so sorry for your loss . One of my favourite unisex names is [ NAME ] .	24	remorse
Oh god , [ NAM ] is terrible . My kid loves it though , and Dr [ NAMEE ]	14	fear
At least she can eat Abel or something so we don ' t have to worry about feeding her .	23	relief
happy cake day	13	excitement
Yes and quite alot of reasons building up . Me , people , past . I hope you will be ok .	5	caring
It just has to be clean and hygienic . Maybe make sure you got food and wine on deck	8	desire
wow , here in Brazil people say the opposite of this phrase , also makes me mad	26	surprise
The cheerfulness of the “ hail satan ” text overlay was unexpected .	26	surprise
Wow that is the exact armor combo i used to use	26	surprise
Personally wish they had a male version of [UNK]	8	desire
No I didn ' t take it that way . My apologies if my comment appeared to be taking a shot at you .	24	remorse
Poor attempt for karma I think	9	disappointment
I only watched a few episodes , but I loved that guy .	13	excitement
Yeah that happens t	22	realization
Also the fishing has been terrible for a month now . I am about to take the 5 story jump my friends .	11	disgust
I ' ll think about prime , just heard a lot of negative about them that spooks me some .	9	disappointment
I didn ' t realise	22	realization
Right . It was wasted screen time . But oh no , we couldn ’ t have a Snoke flash back that was 30 seconds * at most * .	9	disappointment
Redpill is a modern name for an old sentiment . And anyways Matrix came out 20 years ago .	22	realization
Let me calm you down a bit :	5	caring
not quite as cheap but if you already own a decent bike this kit is wel priced to convert	5	caring
Too bad it wasn ’ t a sword .	9	disappointment
Super creepy . And leaving the note is out of line	14	fear
Put away the screen and go outside . You ' ll feel much better .	5	caring
I ’ ve lived in Florida . Hurricanes are * much * worse .	11	disgust
First I was afraid , I was petrified . . .	14	fear
Points . I envy your luck ! My matches generally range from 10 - 29kk : /	8	desire
I ' m interested , more than I should be .	13	excitement
It ' s likely that they don ' t have much , yet still make poor financial decisions .	9	disappointment
Considering that the majority of people who play poker still open limp , I ' m surprised these posts aren ' t more common .	26	surprise
I have a feeling you ' re one of those far rightist trump supporters trying to use [ NAME ] . Your uncaring , almost sociopathic idealogies make me sick .	9	disappointment
Slovenia is awake and ready for some Mavs magic !	13	excitement
Don ' t self - diagnose . Talk to a medical professional and check for known diseases that may cause depression ( hashimoto ' s comes to mind ) .	5	caring
Let ' s all go to Dragon Laaaaaand !	13	excitement
But tbh , i dont think i am disgusting , but my feet still get smelly after a while	11	disgust
Doesn ' t affect you buddy don ' t stress over it .	5	caring
WOW HOLY SHIT	26	surprise
Doctor is Spy ! ~ Grunt , too late .	26	surprise
I ' m so gay I can ' t even drive straight - a bumper sticker older than most redditors	19	nervousness
yeah see some of us come from youtube it ' s a horrible place never go there	14	fear
That live snail got me freaked	14	fear
I ’ m sorry you are feeling so down friend , that is really difficult . I hope find a way to feel better . . maybe go to emergency care . . .	5	caring
Omg I really thought it was a new word for me , not debacle [UNK] she didn ’ t even try	26	surprise
Get your nose hair waxed . Trust me on this .	5	caring
Hence the apology note .	24	remorse
Conversion to make gay people straight . It ' s horrifying	14	fear
Cool ! Well I look dumb but I learned something	21	pride
People back then just might have had a bad memory and kept forgetting about it .	22	realization
Meh , I ' m actually pissed at some of the people I usually defend for getting excited about this too . . . . we did lose our data .	9	disappointment
It involves a relationship with a girl so I need a girls input , sorry I ’ m not sexist or anything .	24	remorse
It ' s an interesting case study in scams	13	excitement
Preach . The nuthuggers and happy go lucky blind sheep if the front office are nowhere to be found . So disappointed in this team .	9	disappointment
Yeah yeah science , but I never said anything about meeting forcing him . That ' s disgusts me .	11	disgust
TBH I was worried he actually hurt [ NAME ] . Glad everyone is ok .	5	caring
I know this was a common thing , but never knew that were so many creative names for it until I read this thread .	22	realization
I guess the trick is not to eliminate susceptibility to 51 % but to minimize it extremely .	22	realization
I ' ve never seen a more adorable tumble	26	surprise
After hearing weights drop - I can ' t imagine they ' re that good for the floor . . . .	26	surprise
Do you need someone to talk to [ NAME ] ? Your comment history is pretty disconcerting .	5	caring
Well then outli your enemy , get pass your old self that is the enemy and you can outliveve the enemy	5	caring
Holy shit ! No way in hell I ' d get that close to DFW in a Cessna !	26	surprise
I feel so guilty that this picture exists . I feel like I need to donate to charity after this .	24	remorse
Wow - never seen negative karma before I clicked on your name lol .	26	surprise
Anyone who needs to get off , please use the Ashton Taper . Message for support , I ’ m here .	5	caring
The look on her face when she lies is like one I ’ d expect on a 6 year old who thinks he ’ s being cute .	22	realization
Reality is often disappointing - TPUSA , probably	9	disappointment
Sorry , I don ’ t see a difference . If you are opposing people ’ s access to something , your opposing that thing .	24	remorse
Omg they are adding audio ? ? ? ! ! Epic really loves to cater to the sweats	13	excitement
I stuck a bit of glass up there . It was a pane in the ass .	24	remorse
I knew a guy named [ NAME ] . Always wondered what his middle name was .	26	surprise
[ NAME ] saved by the very compassion in society that he is trying to destroy .	11	disgust
Maybe she can bartend on the side when Back in NYC . Oh , I forgot her progressive policies put said . Bar out of business .	22	realization
This comment completly proves the opinion of the OP right lmao . I ’ m so sorry America doesn ’ t meet your standards oh mighty reddit commentor	24	remorse
That was so disgusting . VWP	11	disgust
Same here . Waiting for the doctor rn . Hope you ' re ok	5	caring
""" Youd be surprised how many times the "" "" hebephilia is not pedophilia "" "" argument comes up on reddit . """	26	surprise
A one - line whip is still whipping against , although it is a pretty disappointing decision .	9	disappointment
If your walls are not connected sprinkle your lawn in between regularly with diatomaceous earth . It will kill them before they can get to you .	5	caring
This wouldn ’ t feel so bad if sales and footfall weren ’ t but many external pressures were keeping profits down .	9	disappointment
Create new holidays . We need a Ralsei day where we celebrate fluffy bois .	8	desire
Happy Wednesday night brother .	13	excitement
Same here man , terrible feeling	14	fear
Youre gonna be really disappointed when you hear [ NAME ] track with the guy from Degrassi	9	disappointment
Oh [ NAME ] imagining this tween screaming yaaass queen at a poor drag queen made me cringe into a ball	26	surprise
No worries . We just like to make sure everyone is safe and has a voice .	5	caring
At 45 I ' m the youngest in my run of terraces by at least 15 years ago I can see how that would be disturbing .	22	realization
""" My bad . I typo ' d . It should have said "" "" how "" "" . """	9	disappointment
Be more supportive , think about the long road not the moment .	5	caring
We are usually way worse in the 3rd tbf	9	disappointment
Read in the news yesterday that 3 . 6 million have lost their insurance since the rump took office . I wonder how many of them died because of it ?	26	surprise
This is my favorite [ NAME ] joke I ' ve seen	13	excitement
R ALER REDED ALERTT	14	fear
I am now weirdly aroused	13	excitement
I was linked the unarchived link and it has some important updates . Wish the OP wasn ' t so salty and linked the actual	8	desire
We had a long debate about how old Jackie bird is and as per every year were surprised by the result . Was pish	26	surprise
They wont touch a hero if they tweaked it in last 6 - 12 months . Like [ NAME ] , they fucked / nerfed her and thats it .	22	realization
I haven ' t listened to new music since 2006 .	22	realization
I ' m honestly shocked that the Bucks have more subs than us . I was surprised the Wolves had more too .	26	surprise
You might want to look into therapy	5	caring
Hey / r / Hockey Bro ! Sorry about the Sens . At least this made you smile in the dark times .	24	remorse
I don ' t know why but every time I see a meme telling me how good I am it doesn ' t do anything and doesn ' t make me happy	9	disappointment
Sad part is there ’ s Flames fans that think this is true	9	disappointment
May your recovery be swift and your memory of her abuse soon be distant . Safe and happy travels .	5	caring
wow , there ' s no way [ NAME ] should ' er scored that	26	surprise
A surprise , but a welcome one	26	surprise
I ' d be a lot more excited to see [ NAME ] flash the leather at 3b .	13	excitement
Be honest with her . . . or put her on a pedestal just high enough to see up her dress . . . ; )	5	caring
He suddenly realises that ' s not his house .	22	realization
You basically already know the entire series for how much they ' ve talked about it and how brazenly they spoil it .	9	disappointment
I can ’ t believe that ’ s real	26	surprise
[UNK] I was wondering the same thing . It looked almost like a teriyaki .	26	surprise
This is dangerous .	14	fear
Realizing that thirty isn ' t old at all .	22	realization
For some reason , I thought this was one of his Bros trying to save him from her .	5	caring
Oh , I saw it . I was giving him the benefit of the doubt to see if he wound up saying the quiet part out loud .	5	caring
In this day and age I ’ m actually surprised at how many hotels haven ’ t sorted plugs by the beds yet	26	surprise
Who cares . [ NAME ] is draining the swamp . Get over it	5	caring
It ’ s deeply bizarre .	9	disappointment
I wish I could hear Waves with earbuds / headphones for the first time again	8	desire
I know I should be worried , but I am not , which makes me very worried .	14	fear
It ' s crazy , the first day with icy , snowy roads it ' s scary but within a few days , grip and visibility sound like fantasy	14	fear
Go buy some stand - offs . The stop the ladder from falling sideways .	22	realization
The level of denial the top boys reached was astonishing .	26	surprise
I always wanted to be an actor ! Always found it fun to emulate and / or imitate others	8	desire
So that ' s how people get their cars sideways in those crazy pictures . I ' d always wondered .	26	surprise
I do . That thing about your mom is weird . Go get help .	5	caring
I thought you looked familiar , get back over to r / NCAAW	22	realization
True , I misread the post and thought it was applying it to on - field performance . My apologies .	24	remorse
[ NAME ] no , these are horrid on anyone .	14	fear
I once looked for my phone with my phone flash light	12	embarrassment
I ' m afraid you have your terms mixed up -	14	fear
Can ' t remember how many times i died there . Death is easy if you keep spamming holy water in the corner	22	realization
In the least condescending way possible I think you have some gross misconceptions and I ' d like to clear them up .	5	caring
Saaaaame . There ’ s too many damn podcasts , and most of them are too damn long .	9	disappointment
Weird headline . 2 children per mother would be expected to shrink the population .	11	disgust
This is peak Dundee .	22	realization
Well . . . . it ’ s even more weird to drink the milk of other species . . so . . .	11	disgust
You guys will be shocked to know it is another cut of the Ga Spa vid .	26	surprise
This physically hurt me	9	disappointment
Ahh . I forgot that was a thing with large breeds .	22	realization
My pride . I ' m like a roach , unsightly to look at but determined to survive	21	pride
Oh yeah I saw that trailer before Aquaman	13	excitement
I ' m sorry but data and facts are more important than the emotional experience of having lived through something .	24	remorse
I ' m worried he ' s too small . I love his quickness , but sub - 170 is scary for a guy that ' ll be running over the middle .	19	nervousness
. . . Uh huh , interesting	13	excitement
Pilots omg . . . you are not alone there !	26	surprise
I ' m just now realizing that I married a covert narc .	22	realization
I better not screw this up . .	22	realization
I believe that people with the disease give it a chance to mutate when around people who are vaccinated	22	realization
I ' d be terrible at this , I eat so slow .	12	embarrassment
Yeah but it is what it is . Apparently I wasnt as clear as I could have been either .	22	realization
This is why you either keep your distance or shoot them .	22	realization
I hope [ NAME ] makes a full recovery .	8	desire
I take showers at night and I desperately need one atm . My hair has been really greasy recently .	8	desire
I watched the whole thing . I miss that style of cartoon . Simultaneously silly and understated .	9	disappointment
Oh trust me , I thought of that - but I felt as though the phallic shape would cheapen the resemblance to feces	22	realization
I really wanted this to be a real sub .	8	desire
Well , whaddaya know !	26	surprise
Wow ! I ’ ve never seen so many deleted comments , and that ’ s saying something .	26	surprise
[ NAME ] was pretty dumb in s7	9	disappointment
That was my wish in writing this . We all need hope sometimes . Some enchanted evening comes for each of us in its own time I think .	8	desire
Happy cake day !	13	excitement
As a high libido female , I feel the same with posts from males . It ' s slightly relieving to know someone else struggles the same way .	23	relief
Everybody betrayed [ NAM ] [ NAMEE ] . I ' m fed up with this world .	11	disgust
He probably got hurt making the video	9	disappointment
