""" I am sorry for offending you "" "" WoW yOu WoNt Ev LeT mY cHiLd Go ThrEEE aGaInn "" "" how t"	24	remorse
Oooooffff . That ' s real awkward , but I mean that somehow still ended better than I expected so . . Kudos ig ? ?	12	embarrassment
Time to cut him off . Or find a way to get him good help . Cause he sounds a little dangerous .	22	realization
Anything to do with Iceland and Scandinavia has to be rad !	13	excitement
Don ' t worry , all these people will get the rope once I ' ve established my new world order	5	caring
You mean the Chelsea ?	26	surprise
Welcome to the club . She hit me hard 3 months ago n I ' m still recovering .	22	realization
This just made me feel so much better about myself : )	21	pride
what a bizarre post omg	26	surprise
I also relate ( and regret )	24	remorse
That ' s awful . I ' m glad [ NAME ] doing better , but he might have serious trust issues for life .	11	disgust
Oh god no ! ! ! I was gonna get some shipped out to save you some money . Never mind .	26	surprise
The dad is like ARE YOU FUCKING SORRY Jokes aside , good on the dad and the 2nd pissed off dude Tryin to make a change : -	11	disgust
I ’ m * BEGGING * that they get it right by the time [ NAME ] shows up .	8	desire
interesting , I ' d like to see more about this ( when available of course )	13	excitement
Now remember , if something goes wrong , let ' s not get the law involved , one hand washes the other . Oh , that reminds me .	22	realization
It ' s strange i don ' t understand how work reddit , i drop a link when i create a post but it doesn ' t work	26	surprise
Oh cool , the new sign is up : )	13	excitement
[ NAME ] out ? I thought he ’ s been playing pretty well . Wonder why . . .	26	surprise
I am with you . Despite leaving stuff at his place , i am slow but surely done .	5	caring
I understand this keeps many dairies afloat ( source neighbourhood dairy guy , so not 100 per cent sure it ’ s accurate ) .	22	realization
awkward edit - aww are you a rangers fan , damnit	12	embarrassment
I can ’ t believe this blatant police brutality	26	surprise
Oh [ NAME ] . someone finally posted something I can ' t bring myself to finish reading , it ' s too much	26	surprise
When I went on a first date I only took like 2 bite of my food . Felt pretty bad	9	disappointment
Horrible night for dodo	14	fear
If you ' re smearing shit between your cheeks merely from standing might I suggest you take a wider stance when popping and maybe get some more fibre in your diet	5	caring
This is what you get for starring in a mediocre movie	22	realization
Yes ! He ’ s back LOOCH !	13	excitement
Have a nice day sport .	5	caring
I ' m surprised she could operate a suitcase .	26	surprise
this is the perfect example of something that is a terrible combination without being outright disgusting .	11	disgust
wow even the buildings on the poster haven ' t loaded in	26	surprise
It ' s a shame that so many experimental psychology studies are still using such dubious statistical practices .	11	disgust
That is absurd , man . I ' m sorry you don ' t believe in the spirit realm .	24	remorse
Dude was okay ? ! Oh thank god , i figured at best paralyzed from the waist down	23	relief
They should do it even harder now to spite you	8	desire
omg you got me , what do i do now , pls help	13	excitement
Same , there was no thanks or consideration that they ’ d just given her the ‘ night off ’ .	9	disappointment
If only he could ’ ve known that [ NAME ] made it out safe and got to live honestly for a little while	8	desire
Woooooooooo it took long enough but the UYU boys finally did it and made the league	13	excitement
. . . holy crap .	26	surprise
makes me wish friendly fire was a feature	8	desire
Oh wow . Gotta visit it one day .	13	excitement
Oh you know they ’ re BOTH going for it .	26	surprise
Yes I was feeling bad that hes friends left him	9	disappointment
If it ' s legal where you live , then it doesn ' t really matter what anyone thinks .	5	caring
Oo ! OO ! ! I know this one . . . ME !	13	excitement
Finally somewhere where I ' m just an average fucking person Fuck why am I crying	9	disappointment
> 333 Brothers and sisters are here now So much cringe .	14	fear
Maybe you need some time get loss of that thought . Try to ignore it and just enjoy your luck .	5	caring
Well , you stopped coming on CV . Now I am left alone to fend off Agent debaters .	9	disappointment
This stressed me out	19	nervousness
Sorry this is the first time I saw it , I ’ ll delete it .	24	remorse
That ' s what I was talking about . Eat one meal , then hibernate until you ' re so hungry you gotta eat again .	5	caring
She sounds hideous .	11	disgust
Same with [ NAME ] . I was even disappointed Parks and Rec had newt gingrich on for a cameo .	9	disappointment
Probably . Wouldn ' t be surprised if our current generation essentially lives forever . . . or well until something like climate change puts a stop to it .	26	surprise
sometimes i look up at the stars and i wonder if [ NAME ] is masterbating to our conversation somewhere out there	26	surprise
Oh my gooooooooood	26	surprise
""" "" "" I ' ve made a huge mistake "" "" - Me , walking into this person ' s house . """	24	remorse
The supplement industry is another scam . Multi billion dollar industry . Stop wasting your money on GNC prework out drinks and go straight to the real source .	5	caring
Stuff like this makes me worry a little less about the future generations .	19	nervousness
I have , I ' ve always wanted to celebrate Christmas and actually have a more closer family	8	desire
You also have the option of making it quite unique . Would be a delight to see if you got it !	13	excitement
Yeah the non guarenteed packs are really the worst . I think I did 2 / 20 on those .	11	disgust
this video made me feel like screaming	14	fear
I really want to know what the coordinates he gave him are	8	desire
oh wow never heard of that in my life sorry	24	remorse
[ NAME ] man . . . . . I hope this is just one of his overdramatic moments on the floor . . . He ' s scared me like 5 times this year . . . .	14	fear
It ’ s amazing .	13	excitement
So weird watching this segment knowing what happened a couple days ago .	12	embarrassment
Kinda reminds me of Arctic Monkeys ' ' Favourite Worst Nightmare ' cover art	22	realization
Worrying what other people think is what collectivists have brainwashed you to think and feel . You are just a coward making excuses for your cowardice .	19	nervousness
""" You know when I typed "" "" legal tender "" "" I had a horrible feeling I was going down a rabbit hole . """	14	fear
While out at the beach for a weekend for her birthday . There was no final straw , I just wanted to .	9	disappointment
""" This has happened to me with the girls I tried to connect with irl as well as FA "" "" lonely "" "" girls from this very sub """	9	disappointment
[ NAME ] said Monday was Columbus Day and those two bought it . Unbelievable .	26	surprise
I hope [ NAM ] has something cooking . I wanted [ NAMEE ] back	8	desire
I think if you ' re sending and receiving texts longer than 10 words your marriage is doomed .	22	realization
You won be in pain but you wontt feel any relief either . Find what makes you feel comfortable and stick with it	5	caring
Kinda surprised he listed [ N ] and [ NAMAM ] in particular , but not [ NAMEEE ] . I guess this is the Leafs spotlight working in real time here .	26	surprise
Yeah , all the stun cannonballs are horrible .	11	disgust
Wow , the video is a lot worse than I thought . His actions after he asks for the age is very uncomfortable .	26	surprise
Good luck my tw broskies : (	5	caring
Yeah buh idk . I ’ d have to be really horny too and I ’ m really shy and anxious around him .	13	excitement
A quartet of [ N ] , [ NAMAM ] , [ NAMEEE ] and Ox would be lovely .	8	desire
Stay strong ! Get well soon !	5	caring
About every direction , down gives you the same problem as up and every other direction is less effective to escape .	5	caring
I ' m 34 and disappointing my mother is still my greatest fear .	14	fear
I wish I didn ’ t fall for my ex . He is not a beautiful person . He is a monster .	8	desire
The Mets fans in me gets excited for [ NAM ] when I hear [ NAMEE ] theme .	13	excitement
that was clearly only one pump , bad call	9	disappointment
I just saw a snot nosed bra eat a croissantt on the subway and got crumbs all over and the snobby rude mom left like nothing happened .	11	disgust
What have I watched ? ! My eyes ! ! ! Mom ! ! !	26	surprise
I know one time I mixed stuff up and posted the slashes instead of the asterisks to italicize . Oops .	12	embarrassment
So sorry to hear that matey . What a good dog . Give him lots of pets .	24	remorse
Honestly idk that she ruined a moment , she just changed it so it was a different moment between her and [ NAME ]	22	realization
I try to switch it up , too ; probably the main reason for the post . Gets boring sometimes !	22	realization
And to think all along I was wondering if it was left hand turn day or just me !	26	surprise
[ NAME ] why are there so many guendouzi haters ?	26	surprise
None that I know of . Any mental health issue needs to be cared for like any other health issue . Doctors and medications can help .	5	caring
Omg saucepan what a daring and unconventional look ! ! ! 11	26	surprise
Why am I excited for the new season	13	excitement
Omw . When my man sends me that I get all warm and excited cuz I know I get to spends the next couple hours or days with him	13	excitement
I know , this weekend was absolute worse case scenario	9	disappointment
We ' re not roast you . That ' s not how it works here . Go get help and feel better then come back for proper roastinging .	5	caring
Wish you the best of luck and greener pastures !	5	caring
A family friend was just found to have made this comment , I am interested to hear your thoughts .	13	excitement
I so badly wish we could all gain this mindset and keep it . How easy would life be .	8	desire
I find it really strange how people align themselves with or against a politician so strongly .	26	surprise
Stomping the Titans before Christmas in 2012 . I got to watch nearly every playmaker do something big , and got to razz my Titans fan buddy all day .	13	excitement
Frinkiac not working for you ?	9	disappointment
Yep , sure is . Have things gotten better for you , though ?	5	caring
I ’ m still sorry you had to go through that . I ’ m sorry anybody has to experience fear on a daily basis .	24	remorse
I ' m 35 and never knew this was a thing anyone did until I saw this posted on Facebook awhile ago . It looks massively uncomfortable ?	22	realization
That ' s how I used to feel but contracting oneitis added a heaping shitpile of loneliness and agony on top	9	disappointment
NEXT TIME ! ON THE CURSE OF OAK ISLAND !	14	fear
Wish I could vote this up 1 , 000 !	8	desire
Stranger : * * Compliments me * * Me : I ' M SORRY ! !	24	remorse
Might relax you a little bit but definitely don ' t expect some amazing buzz from just 1 15 pill . 15mm might feel like 5 - 7 . 5mggg diazepam .	23	relief
Totally ! ! It was such a relief to see that I wasn ' t the only one ( female HL in a DB ) .	23	relief
As row boats are abandonned all around it could be a very interesting little add . If , few randoms row boats had a old and used one in it	13	excitement
When they touch my arm or shoulder while talking . Usually they do it with no sexual intent at all , but it still gives me butterflies .	13	excitement
[ NAME ] fuckin sucks	11	disgust
The Tommy Gun as a crate weapon ! Just the worst feeling .	11	disgust
No way , man . We ' re gonna keep on rockin ' forever . Forever . Forever . Forever . . .	13	excitement
Only 22 ? Weak .	19	nervousness
i managed to craft that super early in the game and i was so disappointed that i basically could not get drunk	9	disappointment
Weird , FBI did an investigation and proved that never happened . White knights make me cringe .	14	fear
Surprised Colorado ain ’ t got one the way things have been going here past couple years	26	surprise
[ NAME ] didn ' t finish the LPs ! ? Wow . I am in episode 20 something and was expecting him to finish : (	26	surprise
Oh damn , is that who made that up ?	26	surprise
The lucky ones died quick	16	grief
Save money and find a good partner so you can be financially stable with someone you love and do whatever you want the rest of your life .	5	caring
I know that , but it just reminds me of darkest dungeon too	22	realization
Oh . . . welp . [UNK]	9	disappointment
The smell of pipes and cigars reminds me of my grandpa .	22	realization
* price hike for [ NAME ] only . I dropped Netflix last month because of it .	9	disappointment
You ’ re an awful troll . . .	11	disgust
Really ? Edit : Ah yea , I saw the original one . It still reminds me of Wind Maker .	26	surprise
Yeah , that ' s why I ' m not feeling like there ' s much I can do except vent .	9	disappointment
It * feels * unethical ?	11	disgust
I used to have no problems finding them , but I ’ m struggling really hard now	9	disappointment
This is the kind of relationship i want to have , a warm soothing one . . . .	8	desire
Yeah let ' s wrap up AS4 I ' m suddenly so much more excited for S11	13	excitement
This is the worst me format in the history of mememe formats , maybe ever	11	disgust
I was one of the best . I used to get at least 50 matches . Hair loss made me invisible all of the sudden	9	disappointment
They need more with more items because I ' ve never been able to get same day .	9	disappointment
yes ! ! ! Once I realized my body wasn ' t wanting as much food i put my self on intermittent fasting and i love it	22	realization
Surprisingly , not a lot of people know though .	26	surprise
Really wish we had got something like this !	8	desire
A bag of pita chips is really $ 8 ?	26	surprise
Minimum wage hurts small business more than it helps the poor .	9	disappointment
Wow , so that means common tongue isn ’ t English ! ? !	26	surprise
Miami is supposed to have beautiful people , but these camera shots of the crowd sure as hell aren ' t showing them .	9	disappointment
that was a horrible fix	14	fear
I want this poster so bad .	8	desire
You should make your own listing to showcase exactly this . Should be easy if it ' s as rampant as you say it is .	5	caring
Better get a paternity test sorted for my munch of a partner and his equally munchkinkin daughter , he ' ll be thrilled .	5	caring
Sorry , but getting shot at causes an almost instinct natural reflexiveive reaction to shoot back . I guess I ' m just weird like that .	24	remorse
I ’ m sorry I only have orange ones : (	24	remorse
""" Really didn ' t like . I thought it was nasty and mean - spirited . "" "" [ NAME ] "" "" on ice it isn ' t . """	11	disgust
I see why magic fans want [ NAME ] off their team .	22	realization
Bahaha I wish ! I copied and pasted it off the internet but yeah that ’ s some serious research	8	desire
""" I read that more as "" "" shut up , hypocrite "" "" than "" "" he ' s not that bad "" "" . """	22	realization
""" When he said , "" "" IT ' S CALLED RESPECT "" "" and gritted through his teeth - - wow , he is just waiting to let his hands fly . """	26	surprise
[ NAME ] , Big Bang Theory is terrible so glad it ' s going to be gone .	23	relief
My bad sorry , what I meant to say is ‘ for our winning season ’ not ‘ in our ’ .	24	remorse
It is . Something I ' ve wondered about many times	26	surprise
I wish that show would come back	8	desire
Damn * fabulous * !	13	excitement
It started to compute for me when I was “ right ” all the time but never ended up getting what I wanted .	9	disappointment
I dream of a world where that won ' t even be an option .	8	desire
I need to save this for hipster resistance supporters	8	desire
Classic Trap game . . . I ' m nervous . Hope our boys aren ' t hungover .	19	nervousness
[ NAME ] looks too creepy , but it ' s a very nice drawing .	14	fear
Oh yes ! Here ' s an Imgur link to the first three I saw .	13	excitement
Maybe one day but I am very cultured *	8	desire
Hopefully it helps you keep your emotions in check rather than letting others control you , [ NAME ] .	5	caring
I think you responded to the wrong comment .	22	realization
He has the maturity of a 2 year old and you are right . . . ugly in his soul .	11	disgust
""" [ NAME ] I hate bad mondays at work ! He needs to fiind a new job , this one is full of ” bad clients "" "" . . . """	9	disappointment
I want to see him succeed . Mostly because his last name makes me think of the bad guy from Shrek	5	caring
yeah I can see myself in that too . I lost all feeling for responsibilty . except for going to work .	22	realization
It feels to me like your Dean has some baggage and you shouldn ' t let it weigh you down .	5	caring
Cancel your trip , man . This shit all too much for you	5	caring
[ NAME ] bless you	5	caring
Talk to your grandparents . . . you will be surprised on how much general knowledge they have to share .	26	surprise
I ' ve been playing this game since release and didn ' t even know that !	12	embarrassment
Everyday , always , I am a hero inside my head	21	pride
I ' m so sorry . She ' s a very lucky cat to have people who love her so much .	9	disappointment
We occasionally awake from our routines and wonder if we are still alive .	22	realization
* hugs my teddy bear and starts crying *	5	caring
Didn ' t really help who the Master is but [ NAME ] will lose his damn mind . We video game worlds now .	9	disappointment
Sorry sorry sorry sorry sorry	24	remorse
Oh baby a triple !	26	surprise
I know you will make her proud . always appreciate your parents they won ’ t be here forever [UNK]	5	caring
I ’ m scared to fall asleep — — -	14	fear
I ’ m sorry and I hope you are better now than when you were in the marriage .	5	caring
It makes me super fucking nervous edit : was able to buy temple at + 1 fuck it lets ride	19	nervousness
I wish I had seen this as a teenager : (	8	desire
Hey fellow conservative , you seem concerned .	5	caring
""" I felt it once , then I quickly realised I was horribly mistaken when someone better came . There ' s no such a thing as "" "" the one "" "" """	24	remorse
is this sub scared to talk about [ NAME ] getting arrested	14	fear
After all that i expected it to not look terrible . Oh well .	14	fear
That ' s the same thing 8 year olds use to try and get my items in video games . The guilt and shame strategy . . . Pathetic .	24	remorse
Seeing something like this without the usual “ Wii music ” is so . . . odd	9	disappointment
Yes , sorry reddit told me 2 times a error occured while posting this : / Looks like it got submitted fine tho : /	24	remorse
That ' s the idea , don ' t be so indignant that I called out your bs .	5	caring
What dose are you taking and how long did it take to help ? I ' ve been trying the Lazarus 50mg / ml . Not seeing any obvious improvement so far .	9	disappointment
I want to go back in time and hug you as a child ( after you got the lice treated tho ) .	8	desire
My baby niece does this . She fell down a couple stairs in her time and now is real careful with them	22	realization
stay safe man	5	caring
OMG are you serious ? Do you know what episode ? That ' s horrendous ! I ' m really disappointed in [ NAME ] on that one .	9	disappointment
Sorry , no . We ’ re just going to export [ NAME ] to you guys .	24	remorse
Edited : Sorry meant to reply to a post	24	remorse
> traffic through there in the summer is awful because that ’ s where everyone wants to be . your life starts to revolve around bridge time .	11	disgust
Omg I could cry at this	26	surprise
An indie rock guy I loved used dialectics to explain his songwriting process , it was weird .	12	embarrassment
If Android : YouTube Vanced is your new best friend . If IOS : sorry lol get a real phone	13	excitement
it ' s not but damn i ' m sorry to hear how common this is	24	remorse
Wow . You basically found my dream woman and gave her up .	26	surprise
hahaha . I was / am honestly surprised that is the only time I ' ve heard of a parent calling a rapid .	26	surprise
One of my cats always eats the other ones food . I never noticed it until he was obese . I ' m not gonna make that mistake again .	22	realization
My hair never scrunched and I was so jealous	9	disappointment
Damnit . Have a big trip planned for the first week of February . Can ' t wait to get to the airport 5 hours early .	13	excitement
I am sorry but I can feel a panic attack . Holy moly I would die instantly If I were him	19	nervousness
Yes you pretty much summed it up . Wanted her out of that career that was destroying her .	5	caring
You hang your head in shame . Not because of this , but just in general .	12	embarrassment
So glad to hear they got banned . Can ' t believe adults can still behave like that .	26	surprise
Stay strong and keep going . Chiche but true : living well is the best revenge .	5	caring
Like and smash that subscribe button , I ' ll see you in the next video for my best v - bucks giveaway yet	13	excitement
No . I wishm Why did I stop ? Kids work and money . Not a minute to myself	26	surprise
Oh wow , that was a serendipitous ending ! The weed saved her life .	26	surprise
What ? They all look entirely different . Yes , they are all handsome , masculine men , but that ' s it .	26	surprise
It would be exciting I guess .	13	excitement
Good [ NAME ] we look horrible	11	disgust
I want to come back as a tree	8	desire
Plus she ' s probably going through some extreme grief , life insurance is a huge practical concern for her right now .	5	caring
This sub is filled with bitterness .	9	disappointment
That literally doesn ’ t even look like her omg	26	surprise
Nutter is a great word for it . I haven ' t even gotten into her claim that she is psychic yet . That ' s a story for another day .	22	realization
this was hard to watch but i ’ d take it over the grungy redhead talking about her full tummy	11	disgust
I would think terrible , awful things .	14	fear
I am just like this ! Glad to know I ’ m not imagining it .	21	pride
Just take it easy son .	5	caring
We ' re moving from Utah to California later this year . These statistics make me even more excited ! !	13	excitement
I just can ' t believe she had the nerve to call both [ NAM ] and [ NAMEE ] low ability	26	surprise
That ’ s my favorite insult ever	9	disappointment
That ' s a welcome relief . Lol .	23	relief
My god , [ NAME ] !	26	surprise
Aghh bacon is actually the worst . The smell of it is soo disgusting you can smell the dirtiness	11	disgust
The stress that effects you stresses the baby before it ’ s born . It effects the bond you have and even your milk supply if you breastfeed .	5	caring
Nobody said they don ' t have the right . It ' s still embarrassing .	12	embarrassment
Your opinion doesn ' t matter , the judge ' s does . Like I said , if you want better answers , then consult a family law attorney in your area .	5	caring
It could be how depression is effecting you but i don ' t think it ' s crazy	5	caring
Doesn ' t look like any 12 year old I ' ve ever seen .	26	surprise
0 < - - - - - This is how many people were surprised	26	surprise
It ' s uncanny	26	surprise
So many ? I ’ d be amazed if it was more than 0 . 1 % of active players at any time	26	surprise
I ' m so proud of you !	21	pride
Gotcha . Given how contentious even the top - tiers are , I wanted to play it safe .	8	desire
I ’ m so sorry for your loss . . . if you ever want to queue PM me for my steam	24	remorse
oh my [ NAME ] is this real	26	surprise
Totally . I didn ’ t even realize it was my dream until it happened .	22	realization
Can we get a guard too ? This is my dream .	8	desire
* * I can ' t believe she held out for a full 24 hours before flip - flopping * *	26	surprise
I feel so much safer when my doctors are only abusing prescription medication . . . / s	5	caring
it only flatters them when they ’ re posed a certain way . but other than that , it looks awful and uncomfortable	11	disgust
I ' m really interested in seeing those other 6	13	excitement
first time all season im kind of not thrilled with [ NAME ] post game talk . I wish he would have addressed the PP .	8	desire
We look like Hawks at this time . Good old days	22	realization
Sounds like some people could just be a bit confused and maybe not been to a drive thru before	22	realization
Goddamn I ’ m excited about this football team !	13	excitement
I feel I should do this even after living here for 7 years , I ' ve barely done any touristy things ! Shame on me .	12	embarrassment
You could wish for it to cure stupidity atleast . Obviously it doesnt .	8	desire
Disgusting , but fascinating .	11	disgust
And caressing your hair . . I ’ m not even a woman and that makes me shudder thinking about that	13	excitement
If you have a pelvic kidney and some back pain , I know of the perfect hospital in Florida for you .	5	caring
Wow what a surprise . . .	26	surprise
Everyone hates these posts but when we do post them it ’ s because we too are also proud of the work we do . Congrats !	21	pride
im alright my dude , didn ’ t realize how dark this was i might take it down	22	realization
Their numbers seem large because they get so much publicity . But I suspect that even most young people find that ludicrous .	11	disgust
""" "" "" every time she was in trouble I was there for her "" "" - the man who caused most of her troubles """	5	caring
I always thought the U was for urine . . well this is going to be awkward .	12	embarrassment
It looks like Marvin the Martian ' s ship . I ' m still geeked as hell though . Also glad they provided a space suit for scale .	13	excitement
